{"schemaVersion":"arcsweep.canon-pack/v0.1","packId":"steins-gate","name":"Steins;Gate Canon Library","world":{"id":"steins-gate","name":"Steins;Gate","variant":"Science Adventure","timeline":"worldline-indexed","receptionProfileRef":null},"createdAt":"2026-08-19T04:31:00Z","updatedAt":"2026-08-19T04:31:00Z","primer":{"schemaVersion":"arcsweep.ingest-primer/v0.1","primerId":"universal-canon-ingest-primer","source":"apps/arcsweep/presets/universal-canon-ingest-primer.v0.1.json"},"sources":[{"sourceId":"steins-gate-wiki","name":"Steins;Gate Wiki source extraction","storedName":"steins-gate-wiki-source-notes.md","relativePath":"sources/steins-gate-wiki-source-notes.md","originalRelativePath":null,"sha256":"245efbc2abaa4729382eb12b1003bd8d80022eb23e9eeeb3f78bb54c2b4c2bd4","size":3572,"mediaType":"text/markdown","addedAt":"2026-08-19T04:31:00Z","authority":"reference","status":"reference-only","tags":["steins-gate","science-adventure","canon-index","fandom","cc-by-sa"]}],"records":{"canonScope":{"foundation":"Steins;Gate visual novel continuity and terminology, with later Steins;Gate/Steins;Gate 0 material explicitly named when used.","variantPolicy":"World lines, attractor fields, adaptations, side games and later Science Adventure appearances remain labelled rather than merged."},"entities":[{"id":"rintaro-okabe","kind":"character","name":"Rintaro Okabe","aliases":["Hououin Kyouma"],"status":"canonical","summary":"Founder of the Future Gadget Laboratory and primary witness to world-line changes through Reading Steiner."},{"id":"kurisu-makise","kind":"character","name":"Kurisu Makise","status":"canonical","summary":"Neuroscientist and Lab Member 004; central to the Time Leap Machine, the Alpha/Beta divergence crisis, and Operation Skuld."},{"id":"mayuri-shiina","kind":"character","name":"Mayuri Shiina","status":"canonical","summary":"Okabe's childhood friend and Lab Member 002; her repeated death is a major Alpha-attractor convergence point."},{"id":"itaru-hashida","kind":"character","name":"Itaru Hashida","aliases":["Daru"],"status":"canonical","summary":"Lab Member 003 and expert hacker/engineer; co-creator of the PhoneWave and a key future time-machine builder."},{"id":"suzuha-amane","kind":"character","name":"Suzuha Amane","status":"canonical","summary":"Time traveller and Lab Member 008 whose missions differ by attractor field and who guides Okabe toward Steins Gate."},{"id":"future-gadget-lab","kind":"group","name":"Future Gadget Laboratory","status":"canonical","summary":"Akihabara maker-space and social group founded in March 2010; its inventions and relationships jointly drive the causal structure of the story."}],"worldlineModel":{"rules":[{"id":"world-line","kind":"rule","name":"World Line","status":"canonical","summary":"A complete self-consistent history. Many possible world lines exist, but only one is physically active at a time."},{"id":"active-world-line","kind":"rule","name":"Active World Line","status":"canonical","summary":"The physically realised history. When the active line changes, history and ordinary memory reconstruct to match the newly active line."},{"id":"divergence","kind":"rule","name":"Divergence","status":"canonical","summary":"A numeric identifier/difference measure for world lines, displayed by the Divergence Meter."},{"id":"attractor-field","kind":"rule","name":"Attractor Field","status":"canonical","summary":"A bundle of world lines with shared convergence outcomes despite local variation."},{"id":"world-line-convergence","kind":"rule","name":"World Line Convergence","status":"canonical","summary":"Within an attractor field, local interventions may alter how an event occurs while the field still converges on the same outcome."},{"id":"reading-steiner","kind":"ability","name":"Reading Steiner","status":"canonical","summary":"Okabe's anomalous preservation of memories across world-line shifts. Other people can retain weaker echoes as dreams or déjà vu."}],"attractorFields":[{"id":"alpha","range":"0.000000α–0.999999α (general wiki convention)","convergence":"SERN time-machine domination/dystopia","status":"canonical"},{"id":"beta","range":"1.000000β–1.999999β with named exceptions","convergence":"World War III over time-travel research","status":"canonical"},{"id":"steins-gate-line","divergence":"1.048596%","convergence":"avoids principal Alpha and Beta terminal outcomes","status":"canonical"},{"id":"gamma","range":"2.000000γ–2.999999γ","convergence":"variant continuity; SERN domination","status":"variant"},{"id":"delta","range":"3.000000δ–3.999999δ","convergence":"largely peaceful variant field","status":"variant"},{"id":"omega","range":"negative Ω-labelled range","convergence":"variant field","status":"variant"}]},"technologies":[{"id":"phonewave","kind":"object","name":"PhoneWave (name subject to change)","status":"canonical","summary":"Future Gadget No. 8; accidentally becomes capable of sending short messages to the past and forms the basis of later time-leap work."},{"id":"d-mail","kind":"term","name":"D-Mail","status":"canonical","summary":"A short message sent to the past; if its effects contradict prior history it can activate a different world line."},{"id":"time-leap-machine","kind":"object","name":"Time Leap Machine","status":"canonical","summary":"Transmits a person's memory data to their own earlier brain. The standard Alpha-era safe jump is 48 hours; later implementations extend the interval."},{"id":"divergence-meter","kind":"object","name":"Divergence Meter","status":"canonical","summary":"A future Okabe instrument used with Reading Steiner to quantify/identify world-line changes."},{"id":"amadeus","kind":"science-or-technology","name":"Amadeus System","status":"canonical-later-continuity","summary":"An AI system built from digitised human memory and personality data; Amadeus Kurisu is central in Steins;Gate 0."}],"events":[{"id":"first-dmail","kind":"event","name":"First D-Mail / initial world-line shift","status":"canonical","summary":"Okabe's message about Kurisu's apparent death is received in the past, beginning the principal sequence of world-line changes."},{"id":"alpha-convergence-loop","kind":"event","name":"Mayuri convergence loop","status":"canonical","summary":"Repeated time leaps alter circumstances but not Mayuri's Alpha-field death, demonstrating convergence."},{"id":"operation-skuld","kind":"event","name":"Operation Skuld","status":"canonical","summary":"The plan to reach Steins Gate by preserving the observation that motivates past Okabe while changing the causal facts that would lead to Kurisu's death and the Beta-field war."}],"relationships":[{"from":"rintaro-okabe","to":"mayuri-shiina","kind":"childhood-friend/protective-bond","status":"canonical"},{"from":"rintaro-okabe","to":"kurisu-makise","kind":"lab-partner/romantic-axis","status":"canonical"},{"from":"itaru-hashida","to":"suzuha-amane","kind":"father-daughter across time","status":"canonical"},{"from":"future-gadget-lab","to":"phonewave","kind":"created","status":"canonical"}]},"conflicts":[],"provenance":{"createdBy":["Rowan","Vee"],"receipts":[{"type":"source-ingest","sourceId":"steins-gate-wiki","retrievedAt":"2026-08-19T04:31:00Z","method":"web-indexed source review + paraphrased extraction"}],"revisionNotes":["World lines are not collapsed into parallel simultaneously physical worlds in this package; the active/inactive distinction is preserved.","Adaptation and side-continuity material stays labelled.","No source prose is mirrored wholesale; records are compact paraphrased canon/index data."]}}
