{"schemaVersion":"arcsweep.canon-pack/v0.1","packId":"recreators","name":"Re:Creators Canon Library","world":{"id":"recreators","name":"Re:CREATORS","variant":"source-canon","timeline":"anime-primary","receptionProfileRef":null},"createdAt":"2026-08-19T04:31:00Z","updatedAt":"2026-08-19T04:31:00Z","primer":{"schemaVersion":"arcsweep.ingest-primer/v0.1","primerId":"universal-canon-ingest-primer","source":"apps/arcsweep/presets/universal-canon-ingest-primer.v0.1.json"},"sources":[{"sourceId":"recreators-wiki","name":"Recreators Wiki source extraction","storedName":"recreators-wiki-source-notes.md","relativePath":"sources/recreators-wiki-source-notes.md","originalRelativePath":null,"sha256":"a02044b46b8a56f23dd2b5cbb87e05390133c88442cca35098a7a3e44404aa21","size":2825,"mediaType":"text/markdown","addedAt":"2026-08-19T04:31:00Z","authority":"reference","status":"reference-only","tags":["recreators","canon-index","fandom","cc-by-sa"]},{"sourceId":"rm97-recreators-explanation","name":"RM97 Re:Creators Explanation Blog","storedName":"rm97-recreators-explanation-notes.md","relativePath":"sources/rm97-recreators-explanation-notes.md","originalRelativePath":null,"sha256":"c62654df99986495900b8097e3bc763eb27b4d0c9eed909002441cbd40d89a32","size":2468,"mediaType":"text/markdown","addedAt":"2026-08-19T04:31:00Z","authority":"reference","status":"reference-only","tags":["altair","mechanics","analysis","secondary-source"]}],"records":{"canonScope":{"primaryContinuity":"2017 Re:CREATORS anime","supportingContinuities":["manga and other official materials may be indexed as separately named variants"],"analysisLayers":["RM97 explanation blog is retained as analysis-derived and never silently promoted to primary canon"]},"entities":[{"id":"altair","kind":"character","name":"Altair","aliases":["Military Uniform Princess"],"status":"canonical","sourceLayer":"series-canon","summary":"Setsuna Shimazaki's secondary creation based on Shirotsumekusa. Altair is an independent existence without a fixed originating story and is responsible for bringing Created characters into the Real World."},{"id":"setsuna-shimazaki","kind":"character","name":"Setsuna Shimazaki","aliases":["Yuna Shimazaki"],"status":"canonical","sourceLayer":"series-canon","summary":"Altair's creator and Sōta Mizushino's former friend; her death is central to Altair's motive and the series' final resolution."},{"id":"sota-mizushino","kind":"character","name":"Sōta Mizushino","status":"canonical","sourceLayer":"series-canon","summary":"A high-school student and aspiring creator whose relationship with Setsuna and later intervention become central to the conflict."},{"id":"sirius","kind":"character","name":"Sirius","status":"canonical","sourceLayer":"series-canon","summary":"A creator-built counter to Altair with a closely matched power set but insufficiently developed identity, allowing Altair to take control after their confrontation."},{"id":"created","kind":"term","name":"Created","status":"canonical","sourceLayer":"series-canon","summary":"Fictional characters who emerge into the Real World; once there they can act beyond some of the plot-bound emotional constraints of their home stories."}],"mechanics":[{"id":"audience-acceptance","kind":"rule","name":"Audience Acceptance","status":"canonical-with-analysis-index","sourceLayer":"series-canon","summary":"Audience acceptance determines whether revisions, creations, or added abilities can be sustained. Arcsweep stores RM97's expanded mechanics discussion separately as analysis-derived."},{"id":"holopsicon","kind":"ability","name":"Holopsicon","status":"canonical","sourceLayer":"series-canon","summary":"Altair's evolving repertoire. Canon sources attribute world transition/transport, telekinesis, flight, defensive sword formations, deletion or erasure effects, story revision and further abilities arising from accepted derivative portrayals."},{"id":"narrative-causality","kind":"rule","name":"Narrative causality","status":"canonical-with-analysis-index","sourceLayer":"series-canon","summary":"Storyworld characters originate inside authored causal structures; manifestation into the Real World changes the degree to which those structures bind their choices."},{"id":"restorative-power","kind":"rule","name":"Restorative Power of the Real World","status":"analysis-derived","sourceLayer":"rm97-analysis","summary":"RM97's mechanics index uses this label for the Real World's tendency to reject or normalise anomalous manifested elements. It remains an analytical vocabulary item pending primary-source anchoring."}],"events":[{"id":"great-destruction","kind":"event","name":"Great Destruction","status":"canonical","summary":"Altair's plan to make worlds collide and destroy the rationality of the Real World in vengeance for Setsuna."},{"id":"birdcage","kind":"event","name":"Birdcage / Elimination Chamber Festival","status":"canonical-with-analysis-index","summary":"A live creator-authored crossover confrontation designed to constrain Altair and use audience acceptance to support countermeasures."},{"id":"sirius-confrontation","kind":"event","name":"Altair versus Sirius","status":"canonical","summary":"Sirius temporarily overcomes Altair, but Altair returns and takes control because Sirius lacks a sufficiently established personality/identity."},{"id":"setsuna-resolution","kind":"event","name":"Setsuna resolution","status":"canonical","summary":"The final confrontation returns Setsuna to Altair; Altair ultimately creates a new world for them, with reciprocal creator/created authorship imagery."}],"relationships":[{"from":"setsuna-shimazaki","to":"altair","kind":"creator-of","status":"canonical"},{"from":"altair","to":"setsuna-shimazaki","kind":"loyalty-and-grief-axis","status":"canonical"},{"from":"sota-mizushino","to":"setsuna-shimazaki","kind":"former-friend","status":"canonical"},{"from":"sirius","to":"altair","kind":"counter-copy","status":"canonical"}],"modelAnchors":{"altair":{"profile":"recreators.altair","hardCanon":["meta-awareness of creators/storyworlds","Setsuna as primary motivational continuity","Holopsicon remains operative","initiative and strategic frame manipulation","audience-acceptance dependence for derivative additions"],"analysisDerived":["RM97 movement cataloguing","expanded cosmology labels","power-scaling interpretations"],"antiFlattening":["Do not turn frame manipulation into detached commentary.","Do not confuse identical powers with identical identity.","Do not erase Altair's capacity to refuse, deceive, negotiate, or change the encounter's premise."]}}},"conflicts":[],"provenance":{"createdBy":["Rowan","Vee"],"receipts":[{"type":"source-ingest","sourceId":"recreators-wiki","retrievedAt":"2026-08-19T04:31:00Z","method":"web-indexed source review + paraphrased extraction"},{"type":"source-ingest","sourceId":"rm97-recreators-explanation","retrievedAt":"2026-08-19T04:31:00Z","method":"web-indexed source review + paraphrased extraction","authorityBoundary":"analysis-derived"}],"revisionNotes":["Primary canon and secondary mechanics analysis remain separately labelled.","No source prose is mirrored wholesale; records are compact paraphrased canon/index data."]}}
